{
  "schema": 1,
  "version": "0.1.0-pilot",
  "platform": "snes",
  "license": "GPL-3.0-only",
  "sources": {
    "nintendo-snes-list": {
      "url": "https://www.nintendo.com/en-gb/Games/Nintendo-Switch-download-software/Super-Nintendo-Entertainment-System-Nintendo-Classics-1632515.html",
      "accessed": "2026-10-18",
      "scope": "Only title/platform checked against primary list; no descriptions/images copied. Trademark symbols omitted.",
      "license": "Nintendo page copyrighted; factual title identification only, not artwork or licensed ROM content."
    },
    "pilot-editorial-proposals": {
      "url": null,
      "scope": "Original assistant editorial proposals; not external model API research or human validation.",
      "license": "GPL-3.0-only"
    }
  },
  "games": [
    {
      "id": "atlas:snes:000001",
      "objective": {
        "title": {
          "value": "Super Mario World",
          "confidence": 100,
          "source": "nintendo-snes-list",
          "status": "source_checked",
          "origin": "primary_catalog"
        },
        "platform": {
          "value": "snes",
          "confidence": 100,
          "source": "nintendo-snes-list",
          "status": "source_checked",
          "origin": "primary_catalog"
        },
        "year": null,
        "developer": null,
        "publisher": null,
        "genre": null,
        "mechanics": null,
        "duration": null
      },
      "editorial": {
        "intensity": {
          "value": 55,
          "confidence": 40,
          "source": "pilot-editorial-proposals",
          "status": "proposed",
          "origin": "assistant_proposal",
          "note": "Interpretación inicial, pendiente de contrastar fuentes de juego y escucha/revisión humana; no dato objetivo."
        },
        "exploration": {
          "value": 55,
          "confidence": 40,
          "source": "pilot-editorial-proposals",
          "status": "proposed",
          "origin": "assistant_proposal",
          "note": "Interpretación inicial, pendiente de contrastar fuentes de juego y escucha/revisión humana; no dato objetivo."
        }
      },
      "aliases": [],
      "identity": {
        "work_id": "atlas:snes:000001",
        "region": "unspecified",
        "revision": null,
        "translation": null
      }
    },
    {
      "id": "atlas:snes:000002",
      "objective": {
        "title": {
          "value": "Super Mario World 2: Yoshi's Island",
          "confidence": 100,
          "source": "nintendo-snes-list",
          "status": "source_checked",
          "origin": "primary_catalog"
        },
        "platform": {
          "value": "snes",
          "confidence": 100,
          "source": "nintendo-snes-list",
          "status": "source_checked",
          "origin": "primary_catalog"
        },
        "year": null,
        "developer": null,
        "publisher": null,
        "genre": null,
        "mechanics": null,
        "duration": null
      },
      "editorial": {},
      "aliases": [],
      "identity": {
        "work_id": "atlas:snes:000002",
        "region": "unspecified",
        "revision": null,
        "translation": null
      }
    },
    {
      "id": "atlas:snes:000003",
      "objective": {
        "title": {
          "value": "Super Mario Kart",
          "confidence": 100,
          "source": "nintendo-snes-list",
          "status": "source_checked",
          "origin": "primary_catalog"
        },
        "platform": {
          "value": "snes",
          "confidence": 100,
          "source": "nintendo-snes-list",
          "status": "source_checked",
          "origin": "primary_catalog"
        },
        "year": null,
        "developer": null,
        "publisher": null,
        "genre": null,
        "mechanics": null,
        "duration": null
      },
      "editorial": {},
      "aliases": [],
      "identity": {
        "work_id": "atlas:snes:000003",
        "region": "unspecified",
        "revision": null,
        "translation": null
      }
    },
    {
      "id": "atlas:snes:000004",
      "objective": {
        "title": {
          "value": "The Legend of Zelda: A Link to the Past",
          "confidence": 100,
          "source": "nintendo-snes-list",
          "status": "source_checked",
          "origin": "primary_catalog"
        },
        "platform": {
          "value": "snes",
          "confidence": 100,
          "source": "nintendo-snes-list",
          "status": "source_checked",
          "origin": "primary_catalog"
        },
        "year": null,
        "developer": null,
        "publisher": null,
        "genre": null,
        "mechanics": null,
        "duration": null
      },
      "editorial": {
        "exploration": {
          "value": 85,
          "confidence": 40,
          "source": "pilot-editorial-proposals",
          "status": "proposed",
          "origin": "assistant_proposal",
          "note": "Interpretación inicial, pendiente de contrastar fuentes de juego y escucha/revisión humana; no dato objetivo."
        },
        "resume_ease": {
          "value": 65,
          "confidence": 40,
          "source": "pilot-editorial-proposals",
          "status": "proposed",
          "origin": "assistant_proposal",
          "note": "Interpretación inicial, pendiente de contrastar fuentes de juego y escucha/revisión humana; no dato objetivo."
        }
      },
      "aliases": [],
      "identity": {
        "work_id": "atlas:snes:000004",
        "region": "unspecified",
        "revision": null,
        "translation": null
      }
    },
    {
      "id": "atlas:snes:000005",
      "objective": {
        "title": {
          "value": "Super Metroid",
          "confidence": 100,
          "source": "nintendo-snes-list",
          "status": "source_checked",
          "origin": "primary_catalog"
        },
        "platform": {
          "value": "snes",
          "confidence": 100,
          "source": "nintendo-snes-list",
          "status": "source_checked",
          "origin": "primary_catalog"
        },
        "year": null,
        "developer": null,
        "publisher": null,
        "genre": null,
        "mechanics": null,
        "duration": null
      },
      "editorial": {
        "exploration": {
          "value": 90,
          "confidence": 40,
          "source": "pilot-editorial-proposals",
          "status": "proposed",
          "origin": "assistant_proposal",
          "note": "Interpretación inicial, pendiente de contrastar fuentes de juego y escucha/revisión humana; no dato objetivo."
        },
        "mystery": {
          "value": 85,
          "confidence": 40,
          "source": "pilot-editorial-proposals",
          "status": "proposed",
          "origin": "assistant_proposal",
          "note": "Interpretación inicial, pendiente de contrastar fuentes de juego y escucha/revisión humana; no dato objetivo."
        }
      },
      "aliases": [],
      "identity": {
        "work_id": "atlas:snes:000005",
        "region": "unspecified",
        "revision": null,
        "translation": null
      }
    },
    {
      "id": "atlas:snes:000006",
      "objective": {
        "title": {
          "value": "Star Fox",
          "confidence": 100,
          "source": "nintendo-snes-list",
          "status": "source_checked",
          "origin": "primary_catalog"
        },
        "platform": {
          "value": "snes",
          "confidence": 100,
          "source": "nintendo-snes-list",
          "status": "source_checked",
          "origin": "primary_catalog"
        },
        "year": null,
        "developer": null,
        "publisher": null,
        "genre": null,
        "mechanics": null,
        "duration": null
      },
      "editorial": {},
      "aliases": [],
      "identity": {
        "work_id": "atlas:snes:000006",
        "region": "unspecified",
        "revision": null,
        "translation": null
      }
    },
    {
      "id": "atlas:snes:000007",
      "objective": {
        "title": {
          "value": "F-ZERO",
          "confidence": 100,
          "source": "nintendo-snes-list",
          "status": "source_checked",
          "origin": "primary_catalog"
        },
        "platform": {
          "value": "snes",
          "confidence": 100,
          "source": "nintendo-snes-list",
          "status": "source_checked",
          "origin": "primary_catalog"
        },
        "year": null,
        "developer": null,
        "publisher": null,
        "genre": null,
        "mechanics": null,
        "duration": null
      },
      "editorial": {
        "intensity": {
          "value": 85,
          "confidence": 40,
          "source": "pilot-editorial-proposals",
          "status": "proposed",
          "origin": "assistant_proposal",
          "note": "Interpretación inicial, pendiente de contrastar fuentes de juego y escucha/revisión humana; no dato objetivo."
        },
        "short_sessions": {
          "value": 80,
          "confidence": 40,
          "source": "pilot-editorial-proposals",
          "status": "proposed",
          "origin": "assistant_proposal",
          "note": "Interpretación inicial, pendiente de contrastar fuentes de juego y escucha/revisión humana; no dato objetivo."
        }
      },
      "aliases": [],
      "identity": {
        "work_id": "atlas:snes:000007",
        "region": "unspecified",
        "revision": null,
        "translation": null
      }
    },
    {
      "id": "atlas:snes:000008",
      "objective": {
        "title": {
          "value": "Stunt Race FX",
          "confidence": 100,
          "source": "nintendo-snes-list",
          "status": "source_checked",
          "origin": "primary_catalog"
        },
        "platform": {
          "value": "snes",
          "confidence": 100,
          "source": "nintendo-snes-list",
          "status": "source_checked",
          "origin": "primary_catalog"
        },